{
  "$schema": "https://json-schema.org/draft/2020-12/schema",
  "type": "object",
  "properties": {
    "protocolVersion": {
      "$ref": "#/$defs/__schema0"
    },
    "id": {
      "$ref": "#/$defs/__schema1"
    },
    "ownerId": {
      "$ref": "#/$defs/__schema1"
    },
    "revision": {
      "$ref": "#/$defs/__schema2"
    },
    "subject": {
      "$ref": "#/$defs/__schema3"
    },
    "criterion": {
      "$ref": "#/$defs/__schema4"
    },
    "verificationMethod": {
      "$ref": "#/$defs/__schema5"
    },
    "createdAt": {
      "$ref": "#/$defs/__schema8"
    }
  },
  "required": [
    "protocolVersion",
    "id",
    "ownerId",
    "revision",
    "subject",
    "criterion",
    "verificationMethod",
    "createdAt"
  ],
  "additionalProperties": false,
  "$defs": {
    "__schema0": {
      "type": "string",
      "const": "0.4"
    },
    "__schema1": {
      "type": "string",
      "minLength": 1,
      "maxLength": 128,
      "pattern": "^[A-Za-z0-9][A-Za-z0-9._:-]*$"
    },
    "__schema2": {
      "type": "integer",
      "exclusiveMinimum": 0,
      "maximum": 9007199254740991
    },
    "__schema3": {
      "type": "object",
      "properties": {
        "kind": {
          "type": "string",
          "enum": [
            "outcome",
            "work_unit"
          ]
        },
        "id": {
          "$ref": "#/$defs/__schema1"
        },
        "revision": {
          "type": "integer",
          "exclusiveMinimum": 0,
          "maximum": 9007199254740991
        }
      },
      "required": [
        "kind",
        "id",
        "revision"
      ],
      "additionalProperties": false
    },
    "__schema4": {
      "type": "string",
      "minLength": 1,
      "maxLength": 2048,
      "pattern": "\\S"
    },
    "__schema5": {
      "oneOf": [
        {
          "type": "object",
          "properties": {
            "kind": {
              "type": "string",
              "const": "deterministic_read_back"
            },
            "capability": {
              "$ref": "#/$defs/__schema1"
            },
            "targetRef": {
              "$ref": "#/$defs/__schema1"
            },
            "assertion": {
              "type": "object",
              "properties": {
                "operator": {
                  "type": "string",
                  "const": "digest_equals"
                },
                "expectedDigest": {
                  "$ref": "#/$defs/__schema6"
                }
              },
              "required": [
                "operator",
                "expectedDigest"
              ],
              "additionalProperties": false
            }
          },
          "required": [
            "kind",
            "capability",
            "targetRef",
            "assertion"
          ],
          "additionalProperties": false
        },
        {
          "type": "object",
          "properties": {
            "kind": {
              "type": "string",
              "const": "deterministic_artifact_check"
            },
            "capability": {
              "$ref": "#/$defs/__schema1"
            },
            "artifactRef": {
              "$ref": "#/$defs/__schema1"
            },
            "assertion": {
              "type": "object",
              "properties": {
                "operator": {
                  "type": "string",
                  "const": "digest_equals"
                },
                "expectedDigest": {
                  "$ref": "#/$defs/__schema6"
                }
              },
              "required": [
                "operator",
                "expectedDigest"
              ],
              "additionalProperties": false
            }
          },
          "required": [
            "kind",
            "capability",
            "artifactRef",
            "assertion"
          ],
          "additionalProperties": false
        },
        {
          "type": "object",
          "properties": {
            "kind": {
              "type": "string",
              "const": "declared_semantic_check"
            },
            "capability": {
              "$ref": "#/$defs/__schema1"
            },
            "targetRef": {
              "$ref": "#/$defs/__schema1"
            },
            "model": {
              "$ref": "#/$defs/__schema7"
            },
            "harness": {
              "$ref": "#/$defs/__schema7"
            },
            "grader": {
              "$ref": "#/$defs/__schema7"
            },
            "evidence": {
              "type": "object",
              "properties": {
                "ref": {
                  "$ref": "#/$defs/__schema1"
                },
                "version": {
                  "$ref": "#/$defs/__schema1"
                },
                "digest": {
                  "$ref": "#/$defs/__schema6"
                }
              },
              "required": [
                "ref",
                "version",
                "digest"
              ],
              "additionalProperties": false
            },
            "independenceDisclosure": {
              "type": "object",
              "properties": {
                "independentFromProducer": {
                  "type": "boolean"
                },
                "disclosure": {
                  "type": "object",
                  "properties": {
                    "ref": {
                      "$ref": "#/$defs/__schema1"
                    },
                    "digest": {
                      "$ref": "#/$defs/__schema6"
                    }
                  },
                  "required": [
                    "ref",
                    "digest"
                  ],
                  "additionalProperties": false
                }
              },
              "required": [
                "independentFromProducer",
                "disclosure"
              ],
              "additionalProperties": false
            }
          },
          "required": [
            "kind",
            "capability",
            "targetRef",
            "model",
            "harness",
            "grader",
            "evidence",
            "independenceDisclosure"
          ],
          "additionalProperties": false
        }
      ]
    },
    "__schema6": {
      "type": "string",
      "pattern": "^sha256:[a-f0-9]{64}$"
    },
    "__schema7": {
      "type": "object",
      "properties": {
        "id": {
          "$ref": "#/$defs/__schema1"
        },
        "version": {
          "$ref": "#/$defs/__schema1"
        }
      },
      "required": [
        "id",
        "version"
      ],
      "additionalProperties": false
    },
    "__schema8": {
      "type": "string",
      "format": "date-time",
      "pattern": "^(?:(?:\\d\\d[2468][048]|\\d\\d[13579][26]|\\d\\d0[48]|[02468][048]00|[13579][26]00)-02-29|\\d{4}-(?:(?:0[13578]|1[02])-(?:0[1-9]|[12]\\d|3[01])|(?:0[469]|11)-(?:0[1-9]|[12]\\d|30)|(?:02)-(?:0[1-9]|1\\d|2[0-8])))T(?:(?:[01]\\d|2[0-3]):[0-5]\\d(?::[0-5]\\d(?:\\.\\d+)?)?(?:Z|([+-](?:[01]\\d|2[0-3]):[0-5]\\d)))$"
    }
  },
  "$id": "urn:waldo:protocol:responsibility-acceptance-check:0.4:acceptance-check",
  "x-waldo-validation-level": "structural-plus-runtime-invariants",
  "x-waldo-offline-commands": "none"
}
