{
  "protocolVersion": "0.4",
  "id": "acceptance_check_artifact_fixture_01",
  "ownerId": "owner_fixture_01",
  "revision": 1,
  "subject": {
    "kind": "outcome",
    "id": "outcome_fixture_01",
    "revision": 3
  },
  "criterion": "The approved artifact bytes match the owner-reviewed release.",
  "verificationMethod": {
    "kind": "deterministic_artifact_check",
    "capability": "artifact.digest.read",
    "artifactRef": "artifact_release_fixture_01",
    "assertion": {
      "operator": "digest_equals",
      "expectedDigest": "sha256:bbbbbbbbbbbbbbbbbbbbbbbbbbbbbbbbbbbbbbbbbbbbbbbbbbbbbbbbbbbbbbbb"
    }
  },
  "createdAt": "2026-08-08T18:00:00.000Z"
}
